{"schema_version":"astrowoof.initial_authoring_wave_binding_bundle.v1","wave_id":"wave_049d85b3c0deec0e26917e89","wave_sha256":"049d85b3c0deec0e26917e899c29ceb167e69a227b7dacfd0a2f3c3d1d24e601","run_id":"run_initial_wave_fixture","route_family":"exact_natal","profile_sha256":"aaaaaaaaaaaaaaaaaaaaaaaaaaaaaaaaaaaaaaaaaaaaaaaaaaaaaaaaaaaaaaaa","preparation_basis_revision":11,"price_book_version":"openai-public-2026-08-07.v1","member_count":6,"ordered_members":[{"action_id":"paid_099b03ae624e8c9a8cbbb207","pass_id":"kevin_1","pass_number":1,"binding":{"run_id":"run_initial_wave_fixture","profile_sha256":"aaaaaaaaaaaaaaaaaaaaaaaaaaaaaaaaaaaaaaaaaaaaaaaaaaaaaaaaaaaaaaaa","prepared_state_revision":11,"stage":"authoring_initial","route":"kevin_1:attempt-001","request_sha256":"1111111111111111111111111111111111111111111111111111111111111111","model":"gpt-5.6-terra","service_level":"interactive","maximum_output_tokens":30000,"commitment_micro_usd":700001,"price_book_version":"openai-public-2026-08-07.v1"},"binding_sha256":"099b03ae624e8c9a8cbbb20769ef555ba39d31d17b34a29e970c465767a61e9a"},{"action_id":"paid_169b770753ead0cf99f7c136","pass_id":"kevin_2","pass_number":2,"binding":{"run_id":"run_initial_wave_fixture","profile_sha256":"aaaaaaaaaaaaaaaaaaaaaaaaaaaaaaaaaaaaaaaaaaaaaaaaaaaaaaaaaaaaaaaa","prepared_state_revision":11,"stage":"authoring_initial","route":"kevin_2:attempt-001","request_sha256":"2222222222222222222222222222222222222222222222222222222222222222","model":"gpt-5.6-terra","service_level":"interactive","maximum_output_tokens":30000,"commitment_micro_usd":700002,"price_book_version":"openai-public-2026-08-07.v1"},"binding_sha256":"169b770753ead0cf99f7c136d2110f5af6198bffd7c0da8848611f23cdf5db88"},{"action_id":"paid_8dbc6a992cf939d5da60fcb1","pass_id":"kevin_3","pass_number":3,"binding":{"run_id":"run_initial_wave_fixture","profile_sha256":"aaaaaaaaaaaaaaaaaaaaaaaaaaaaaaaaaaaaaaaaaaaaaaaaaaaaaaaaaaaaaaaa","prepared_state_revision":11,"stage":"authoring_initial","route":"kevin_3:attempt-001","request_sha256":"3333333333333333333333333333333333333333333333333333333333333333","model":"gpt-5.6-terra","service_level":"interactive","maximum_output_tokens":30000,"commitment_micro_usd":700003,"price_book_version":"openai-public-2026-08-07.v1"},"binding_sha256":"8dbc6a992cf939d5da60fcb1f90b52f370ddbbc613b08070a8a6a1f246c21d46"},{"action_id":"paid_a4412f23080ae60f31ee366d","pass_id":"kevin_4","pass_number":4,"binding":{"run_id":"run_initial_wave_fixture","profile_sha256":"aaaaaaaaaaaaaaaaaaaaaaaaaaaaaaaaaaaaaaaaaaaaaaaaaaaaaaaaaaaaaaaa","prepared_state_revision":11,"stage":"authoring_initial","route":"kevin_4:attempt-001","request_sha256":"4444444444444444444444444444444444444444444444444444444444444444","model":"gpt-5.6-terra","service_level":"interactive","maximum_output_tokens":30000,"commitment_micro_usd":700004,"price_book_version":"openai-public-2026-08-07.v1"},"binding_sha256":"a4412f23080ae60f31ee366d961d1afa08a6ac231dadc7c5cec6f9988c233582"},{"action_id":"paid_95ce70c66bf19860bab662d7","pass_id":"kevin_5","pass_number":5,"binding":{"run_id":"run_initial_wave_fixture","profile_sha256":"aaaaaaaaaaaaaaaaaaaaaaaaaaaaaaaaaaaaaaaaaaaaaaaaaaaaaaaaaaaaaaaa","prepared_state_revision":11,"stage":"authoring_initial","route":"kevin_5:attempt-001","request_sha256":"5555555555555555555555555555555555555555555555555555555555555555","model":"gpt-5.6-terra","service_level":"interactive","maximum_output_tokens":30000,"commitment_micro_usd":700005,"price_book_version":"openai-public-2026-08-07.v1"},"binding_sha256":"95ce70c66bf19860bab662d752674a1184345e39fd7df4afee5454b3aef74e77"},{"action_id":"paid_0aded189251eab18c5e20d37","pass_id":"kevin_6","pass_number":6,"binding":{"run_id":"run_initial_wave_fixture","profile_sha256":"aaaaaaaaaaaaaaaaaaaaaaaaaaaaaaaaaaaaaaaaaaaaaaaaaaaaaaaaaaaaaaaa","prepared_state_revision":11,"stage":"authoring_initial","route":"kevin_6:attempt-001","request_sha256":"6666666666666666666666666666666666666666666666666666666666666666","model":"gpt-5.6-terra","service_level":"interactive","maximum_output_tokens":30000,"commitment_micro_usd":700006,"price_book_version":"openai-public-2026-08-07.v1"},"binding_sha256":"0aded189251eab18c5e20d3779a8fe2896aec2d77c2445c7272ad4d9968f58b2"}],"aggregate_maximum_commitment_micro_usd":4200021,"bundle_sha256":"c1c4c44afe649f7dcb1eb66c1ac7a3b3d1aea2449f8111b6d7582bc8303f43ad"}
