{"schema_version":"astrowoof.initial_authoring_wave_binding_bundle.v1","wave_id":"wave_f830efd2c0245a9fe0626c55","wave_sha256":"f830efd2c0245a9fe0626c55e7acc78b58ae2b9ef29a1ae5c57d1b184a8da0b9","run_id":"run_initial_wave_fixture","route_family":"bounded_natal","profile_sha256":"aaaaaaaaaaaaaaaaaaaaaaaaaaaaaaaaaaaaaaaaaaaaaaaaaaaaaaaaaaaaaaaa","preparation_basis_revision":11,"price_book_version":"openai-public-2026-08-07.v1","member_count":6,"ordered_members":[{"action_id":"paid_99c9820e4a68a11a53429332","pass_id":"bounded-pass-01","pass_number":1,"binding":{"run_id":"run_initial_wave_fixture","profile_sha256":"aaaaaaaaaaaaaaaaaaaaaaaaaaaaaaaaaaaaaaaaaaaaaaaaaaaaaaaaaaaaaaaa","prepared_state_revision":11,"stage":"authoring_initial","route":"bounded_natal:bounded-pass-01:attempt-001","request_sha256":"1111111111111111111111111111111111111111111111111111111111111111","model":"gpt-5.6-terra","service_level":"interactive","maximum_output_tokens":30000,"commitment_micro_usd":700001,"price_book_version":"openai-public-2026-08-07.v1"},"binding_sha256":"99c9820e4a68a11a53429332187c5a290a3cf3406c88990f4c0c02a81d01b3e5"},{"action_id":"paid_6bffc84371f40392785f9616","pass_id":"bounded-pass-02","pass_number":2,"binding":{"run_id":"run_initial_wave_fixture","profile_sha256":"aaaaaaaaaaaaaaaaaaaaaaaaaaaaaaaaaaaaaaaaaaaaaaaaaaaaaaaaaaaaaaaa","prepared_state_revision":11,"stage":"authoring_initial","route":"bounded_natal:bounded-pass-02:attempt-001","request_sha256":"2222222222222222222222222222222222222222222222222222222222222222","model":"gpt-5.6-terra","service_level":"interactive","maximum_output_tokens":30000,"commitment_micro_usd":700002,"price_book_version":"openai-public-2026-08-07.v1"},"binding_sha256":"6bffc84371f40392785f96160044c57be7c25b72e62ab782eb5495678484f328"},{"action_id":"paid_0eb4c99722928053bbcc804d","pass_id":"bounded-pass-03","pass_number":3,"binding":{"run_id":"run_initial_wave_fixture","profile_sha256":"aaaaaaaaaaaaaaaaaaaaaaaaaaaaaaaaaaaaaaaaaaaaaaaaaaaaaaaaaaaaaaaa","prepared_state_revision":11,"stage":"authoring_initial","route":"bounded_natal:bounded-pass-03:attempt-001","request_sha256":"3333333333333333333333333333333333333333333333333333333333333333","model":"gpt-5.6-terra","service_level":"interactive","maximum_output_tokens":30000,"commitment_micro_usd":700003,"price_book_version":"openai-public-2026-08-07.v1"},"binding_sha256":"0eb4c99722928053bbcc804d1c8cb9c1328edce0c2395c05e5e8d0930fad03d5"},{"action_id":"paid_b2e2762af953b0c70107466f","pass_id":"bounded-pass-04","pass_number":4,"binding":{"run_id":"run_initial_wave_fixture","profile_sha256":"aaaaaaaaaaaaaaaaaaaaaaaaaaaaaaaaaaaaaaaaaaaaaaaaaaaaaaaaaaaaaaaa","prepared_state_revision":11,"stage":"authoring_initial","route":"bounded_natal:bounded-pass-04:attempt-001","request_sha256":"4444444444444444444444444444444444444444444444444444444444444444","model":"gpt-5.6-terra","service_level":"interactive","maximum_output_tokens":30000,"commitment_micro_usd":700004,"price_book_version":"openai-public-2026-08-07.v1"},"binding_sha256":"b2e2762af953b0c70107466fd5d55d43ed85d3667cb8901bdaabd605eb417d47"},{"action_id":"paid_b8dd68619bc972c6af09d166","pass_id":"bounded-pass-05","pass_number":5,"binding":{"run_id":"run_initial_wave_fixture","profile_sha256":"aaaaaaaaaaaaaaaaaaaaaaaaaaaaaaaaaaaaaaaaaaaaaaaaaaaaaaaaaaaaaaaa","prepared_state_revision":11,"stage":"authoring_initial","route":"bounded_natal:bounded-pass-05:attempt-001","request_sha256":"5555555555555555555555555555555555555555555555555555555555555555","model":"gpt-5.6-terra","service_level":"interactive","maximum_output_tokens":30000,"commitment_micro_usd":700005,"price_book_version":"openai-public-2026-08-07.v1"},"binding_sha256":"b8dd68619bc972c6af09d166de9cee71c66699120ff1e57bf78232c6daa722fa"},{"action_id":"paid_f78a110be02bf85da1ce8ad2","pass_id":"bounded-pass-06","pass_number":6,"binding":{"run_id":"run_initial_wave_fixture","profile_sha256":"aaaaaaaaaaaaaaaaaaaaaaaaaaaaaaaaaaaaaaaaaaaaaaaaaaaaaaaaaaaaaaaa","prepared_state_revision":11,"stage":"authoring_initial","route":"bounded_natal:bounded-pass-06:attempt-001","request_sha256":"6666666666666666666666666666666666666666666666666666666666666666","model":"gpt-5.6-terra","service_level":"interactive","maximum_output_tokens":30000,"commitment_micro_usd":700006,"price_book_version":"openai-public-2026-08-07.v1"},"binding_sha256":"f78a110be02bf85da1ce8ad2125f91d3de374ce0602d86953e4e16181355be10"}],"aggregate_maximum_commitment_micro_usd":4200021,"bundle_sha256":"cd497479bd6685c2d1a895994bd42a8285acd1b5016153916f2fa43f56bdf23b"}
